### ISSUE TITLE
default setup for macOS (high sierra) always fails to negotiate DHCP

### ISSUE THREAD

**Issue by ninjapostle** [hioa-cs/IncludeOS#1498]
The setup instructions for mac are super clear. When following them perfectly however, there seems to be some issue with the DHCP setup. Negotiation always fails (via timeout) and the fallback configuration is used. 

I'm not very familiar with virtual machines, but my searches into this topic have not helped me work around this. Here is the verbose log of the boot:
```bash
$ boot -v IncludeOS/examples/demo_service/build/IncludeOS_example.img --create-bridge
* <boot>:  VERBOSE mode set for environment
* <VMRunner>:  Loading default config.
* <VMRunner>:  Trying to load config from ~/IncludeOS_install/includeos/vmrunner/vm.default.json
* <VMRunner>:  Successfully loaded vm config
* <VMRunner>:  " Single virtio nic with vanilla cpu features "
* <VMRunner>:  Trying to load config from ./vm.json
* <VMRunner>:  " {} "
* <boot>:  Args to pass to VM:  []
* <boot>:  1 VM initialized. Commencing build- and boot...
* <VMRunner>:  Loading default config.
* <VMRunner>:  Trying to load config from ~/IncludeOS_install/includeos/vmrunner/vm.default.json
* <VMRunner>:  Successfully loaded vm config
* <VMRunner>:  " Single virtio nic with vanilla cpu features "
* <VMRunner>:  Trying to load config from ./vm.json
* <VMRunner>:  " {} "
* <boot>:  Creating bridge
    Creating network bridge for IncludeOS 
    Using default settings 
    Creating bridge bridge43, netmask 255.255.0.0, gateway 10.0.0.1 
    Creating network bridge (requires sudo):
    Configuring network bridge (requires sudo):
* <boot>:  File extension recognized as bootable image
* <VMRunner>:  VM boot, timeout:  None multiboot:  False Kernel_args:  None image_name:  IncludeOS/examples/demo_service/build/IncludeOS_example.img
* <VMRunner>:  Booting with multiboot: False kernel_args:  None image_name: IncludeOS/examples/demo_service/build/IncludeOS_example.img
egrep: /proc/cpuinfo: No such file or directory
* <qemu>:  KVM OFF
* <VMRunner>:  Booting IncludeOS/examples/demo_service/build/IncludeOS_example.img with a bootable disk image
* <VMRunner>:  Command: sudo qemu-system-x86_64 -drive file=IncludeOS/examples/demo_service/build/IncludeOS_example.img,format=raw,if=ide,media=disk -device virtio-net,netdev=net0 -netdev tap,id=net0,script=~/IncludeOS_install/includeos/scripts/qemu-ifup -m 128 -nographic
[ WARNING ] Running with sudo
* <qemu>:  Started process PID  94432
                * Initializing Autoconf plugin
   [ Autoconf ] Running auto configure
[ Network configure ] Configuring network
    [ Network ] Creating stack for VirtioNet on eth0
      [ Inet4 ] Bringing up eth0 on CPU 0
      [ Inet4 ] Negotiating DHCP (10.0s timeout)...
[ Network configure ] Configuration complete
   [ Autoconf ] Finished
================================================================================
 IncludeOS v0.11.0-rc.2 (x86_64 / 64-bit)
 +--> Running [ IncludeOS minimal example ]
~~~~~~~~~~~~~~~~~~~~~~~~~~~~~~~~~~~~~~~~~~~~~~~~~~~~~~~~~~~~~~~~~~~~~~~~~~~~~~~~
*** Basic demo service started ***
<Service> TCP STATUS:
LISTENERS:
Local   Queued
0.0.0.0:80  0

CONNECTIONS:
Proto   Recv    Send    In  Out Local           Remote          State

     [ DHCPv4 ] Negotiation timed out (eth0)
[ Network configure ] DHCP timeout (eth0) - falling back to static configuration
      [ Inet4 ] Network configured
                IP:         10.0.0.42
                Netmask:    255.255.255.0
                Gateway:    10.0.0.1
                DNS Server:     10.0.0.1
```

**Comment by perbu** [comment]
Hi.

Getting DHCP to work on macos is a bit tricky. I haven't really used it much as I'm mostly relying on static IP addresses as they require less setup. But since you've asked I took some time to see if I could get it working.

The good news is I got it working. Here is what I did.

1. Enable NATing on bridge 43

`sudo pfctl -f nat-rules.pf`


nat-rules.pf looks like this:

`nat on en0 from bridge43:network to any -> (en0)`


And then enable forwarding of packets:

`sudo sysctl -w net.inet.ip.forwarding=1
`

That should enable internet access from any hosts on bridge43, including DNS. 

Then I install dnsmasq, through brew. I deleted the default config, just to make sure it doesn't get in the way.

I run dnsmasq like this:

`sudo dnsmasq --listen-address 10.0.0.1 --dhcp-range 10.0.0.2,10.0.0.30,1h -d
`

The -d option is debug, so I can tell what is going on. To have it go into the background, just remove it.

Then I launched the IncludeOS instance, just as you did. I had a tcpdump running on bridge43 to see the packets flowing.

```
09:54:10.638757 IP 0.0.0.0.68 > 255.255.255.255.67: BOOTP/DHCP, Request from 52:54:00:12:34:56, length 544
09:54:11.671153 IP 10.0.0.1.67 > 255.255.255.255.68: BOOTP/DHCP, Reply, length 300
09:54:11.671805 IP 10.0.0.1.67 > 255.255.255.255.68: BOOTP/DHCP, Reply, length 300
09:54:11.673722 IP 0.0.0.0.68 > 255.255.255.255.67: BOOTP/DHCP, Request from 52:54:00:12:34:56, length 544
09:54:11.675429 IP 10.0.0.1.67 > 255.255.255.255.68: BOOTP/DHCP, Reply, length 300

```
As you can see we get an address. IncludeOS confirms:
```
 IncludeOS v0.11.0-rc.2-97-g8778e92e (x86_64 / 64-bit)
 +--> Running [ IncludeOS minimal example ]
~~~~~~~~~~~~~~~~~~~~~~~~~~~~~~~~~~~~~~~~~~~~~~~~~~~~~~~~~~~~~~~~~~~~~~~~~~~~~~~~
*** Basic demo service started ***
      [ Inet4 ] Network configured
                IP: 		10.0.0.24
                Netmask: 	255.255.0.0
                Gateway: 	10.0.0.1
                DNS Server: 	10.0.0.1
     [ DHCPv4 ] Configuration complete (eth0)
<Service> TCP STATUS:

```

So DHCP seem to work fine. You just need someone to answer the DHCP queries. dnsmasq is my preferred way of getting this done. There is a built in DHCP server in macos, but I don't wanna mess around more than I have to.

I'll close the issue, feel free to open it if you have any issues getting this to work.

I'll see if I can get this into a blogpost or perhaps the docs.
